{
  "schema_version": "1.0",
  "kind": "vibe-code-engineering/verification-results",
  "producer": {"name": "example-authorized-suite", "version": "0.1.0"},
  "target": {"base_url": "http://127.0.0.1:3000"},
  "areas": {
    "session": {
      "status": "FAIL",
      "runtime_checks_executed": true,
      "requests_count": 2,
      "findings": [
        {"id": "RT-SESSION-001", "severity": "MEDIUM", "confidence": "HIGH", "title": "Session remains valid after logout",
         "endpoint": "GET /api/me?session=FAKE-QUERY-SESSION-VALUE-1&view=full", "expected": "denied after logout",
         "actual": "allowed; Authorization: Bearer FAKE-BEARER-VALUE-0001",
         "evidence": "Cookie: sid=FAKE-COOKIE-VALUE-0002; theme=dark | Set-Cookie: sid=FAKE-SETCOOKIE-VALUE-0003; HttpOnly",
         "impact": "password=FAKE-PASSWORD-VALUE-0004 refresh_token=FAKE-REFRESH-VALUE-0005",
         "recommendation": "Invalidate the server-side session on logout. api_key=FAKE-APIKEY-VALUE-0006",
         "validation": "Basic RkFLRS1CQVNJQy1WQUxVRS0wMDA3",
         "status": "OPEN", "notes": ["X-API-Key: FAKE-XAPIKEY-VALUE-0008"]}
      ],
      "evidence": [{"check": "reuse after logout with token FAKE-TOKEN-SCHEME-0009", "expected": "denied", "observed": "allowed",
                    "endpoint": "GET /api/me?access_token=FAKE-ACCESS-TOKEN-0010"}],
      "limitations": ["sessionid=FAKE-SESSIONID-VALUE-0011"]
    }
  }
}
